{
  "schema": "assure/scanner-controls-request/v1",
  "organization_floor": {
    "value": {
      "schema": "assure/organization-floor/v1",
      "floor_id": "acme/scanner-floor-2026-07",
      "repository": { "host": "github.com", "owner": "acme", "name": "spec-to-rest" },
      "ref": "refs/heads/main",
      "minimum_profile": "observe",
      "minimum_dispositions": [],
      "protected_inventory": [],
      "protected_control_paths": [],
      "waivable_finding_kinds": [ "explicit-target-missing" ],
      "authorized_debt_owners": [ "team:docs-platform" ],
      "authorized_waiver_issuers": [ "team:release-engineering" ],
      "resource_limits": []
    },
    "expected_digest": "sha256:6f0b1f7a2c9d4e8b5a3c1d0e9f8a7b6c5d4e3f2a1b0c9d8e7f6a5b4c3d2e1f0a",
    "trust_source": "organization-ruleset"
  },
  "debt_snapshot": null,
  "waiver_bundle": null,
  "trusted_time": {
    "value": {
      "schema": "assure/scanner-trusted-time-statement/v1",
      "controller": "github-actions-required-workflow-clock-v1",
      "repository": { "host": "github.com", "owner": "acme", "name": "spec-to-rest" },
      "ref": "refs/heads/main",
      "candidate_identity_digest": "sha256:1a2b3c4d5e6f708192a3b4c5d6e7f8091a2b3c4d5e6f708192a3b4c5d6e7f809",
      "provider_run_id": "987654321",
      "provider_run_attempt": 2,
      "evaluation_instant": "2026-07-12T10:00:00Z",
      "valid_until": "2026-07-12T10:09:00Z"
    },
    "expected_digest": "sha256:9e8d7c6b5a4f30291e8d7c6b5a4f30291e8d7c6b5a4f30291e8d7c6b5a4f3029",
    "provider_run_id": "987654321",
    "provider_run_attempt": 2
  },
  "execution_constraint": null
}
